<?xml version="1.0" encoding="UTF-8"?>
<Gems xmlns:xsi="http://www.w3.org/2001/XMLSchema-instance"
      xsi:noNamespaceSchemaLocation="germs.xsd">
    <Gem preciousness="precious">
        <Name>
            Diamond
        </Name>
        <VisualParamets>
            <Colour>
                Clear
            </Colour>
            <Clarity>
                29
            </Clarity>
            <Border>
                10
            </Border>
        </VisualParamets>
        <Value>
            20
        </Value>
        <Country>
            Russia
        </Country>
    </Gem>
</Gems>